{
  "attemptSHA256": "1c572aad5a4d0bc91376305f420e4a1589212fc3d7082d61e3b4602c0766b311",
  "certificatePEMBase64": "LS0tLS1CRUdJTiBDRVJUSUZJQ0FURS0tLS0tDQpNSUlJRERDQ0J2U2dBd0lCQWdJUUR0UFdHNldRdHJodkdPUXJVK1R6QXpBTkJna3Foa2lHOXcwQkFRc0ZBREJaDQpNUXN3Q1FZRFZRUUdFd0pWVXpFVk1CTUdBMVVFQ2hNTVJHbG5hVU5sY25RZ1NXNWpNVE13TVFZRFZRUURFeXBFDQphV2RwUTJWeWRDQkhiRzlpWVd3Z1J6SWdWRXhUSUZKVFFTQlRTRUV5TlRZZ01qQXlNQ0JEUVRFd0hoY05NalV3DQpPREk0TURBd01EQXdXaGNOTWpZd09UQTBNak0xT1RVNVdqQ0JrVEVMTUFrR0ExVUVCaE1DVlZNeEVUQVBCZ05WDQpCQWdUQ0UxaGNubHNZVzVrTVJVd0V3WURWUVFIRXd4SFlXbDBhR1Z5YzJKMWNtY3hOekExQmdOVkJBb1RMazVoDQpkR2x2Ym1Gc0lFbHVjM1JwZEhWMFpTQnZaaUJUZEdGdVpHRnlaSE1nWVc1a0lGUmxZMmh1YjJ4dloza3hIekFkDQpCZ05WQkFNVEZtVnVaMmx1WlM1aVpXRmpiMjR1Ym1semRDNW5iM1l3Z2dJaU1BMEdDU3FHU0liM0RRRUJBUVVBDQpBNElDRHdBd2dnSUtBb0lDQVFESzhMQlhjMXZxTHkwTC9IZ3FHelJwSU5ISzlla1pMMDNMZTJPUWIxdmlyaDA5DQpyS1Rnemw2MTJ4cEVQWnZvYjNWUU04TVl5WTdZMDcrUFN1NzZ1Ui9xakFpRSswYno1cWpyZ3RxelhBMUpJTjBjDQpDUDdlMGpDL2NRcCtVdU9UU0dyaEZNU1ZSV2VoUE56aFlBSUpQd3JhNnNDRDczVUM3NHF4OGtQK2lkUjZCd2tRDQpZU2dvUFR6Z2twaUZCdlhrQW80VElvY2lpRXhhRU9ZUDIwOFpnY1hIcGhCMmdiL1RLS2xBM3I5YVRZVUlaY3BUDQoyM01URW1WNjkxM1Q4T0RDK0N5Uk5TWjBPdklPMHVYek5wT0hHenNkL0FuVDVDNlQrOWFNV3grNElqZVJnbDN6DQp3dVA5Y25OTWJKVUpRMnFmR2lRQTIvNENyMTlvSE4rWGlCUUlnc1gyUm1QdVZSVUFHcFFycXpURjV6K092R3V0DQpnYUE2WkwwU1V5TjlLblJPMEtrVnFiMWxXYWNsQ0VFaUlKVFhqQzl0Q28xeEYwd0daeWVIcmJXSTRUcUtLZ25LDQpDLy9OZWpjbENhaytsaTFIVzAyVnR0amF2NFBobGNuU0kwZi91VzZsampPRzBUUWRKaXFXTE4ralRaRVpRMkNtDQpNTFJKUUxmai9icnRpNEorSUZaRWpERjNDd0s4ZGFmK24zNmhlN0oxUEF3UkNXTnNLRXhJeUd6UVR5V0dmSjlWDQpUejlsanRZNSt6eitoQTVQVFVhUFZPelV6SHlsOTcyMjdrUGY0S2FKUVlNd2EyVWY2N3ptekN2M05adFZBQ28yDQpwVkp2WXdGWmhqRzhSVGhnWTYwS0paSGNKbnVod0cwQ0hCckhwQXJyeUxyZGVNV0VlUGQrNythQ1d1ODhLUUlEDQpBUUFCbzRJRGxUQ0NBNUV3SHdZRFZSMGpCQmd3Rm9BVWRJV0F3R2JIM3pmZXo3MHBONm9ESGI3dHpSY3dIUVlEDQpWUjBPQkJZRUZGVS9yWmJwMzFnU2hxenl3NEliT1B2M05UVVRNQ0VHQTFVZEVRUWFNQmlDRm1WdVoybHVaUzVpDQpaV0ZqYjI0dWJtbHpkQzVuYjNZd1BnWURWUjBnQkRjd05UQXpCZ1puZ1F3QkFnSXdLVEFuQmdnckJnRUZCUWNDDQpBUlliYUhSMGNEb3ZMM2QzZHk1a2FXZHBZMlZ5ZEM1amIyMHZRMUJUTUE0R0ExVWREd0VCL3dRRUF3SUZvREFkDQpCZ05WSFNVRUZqQVVCZ2dyQmdFRkJRY0RBUVlJS3dZQkJRVUhBd0l3Z1o4R0ExVWRId1NCbHpDQmxEQklvRWFnDQpSSVpDYUhSMGNEb3ZMMk55YkRNdVpHbG5hV05sY25RdVkyOXRMMFJwWjJsRFpYSjBSMnh2WW1Gc1J6SlVURk5TDQpVMEZUU0VFeU5UWXlNREl3UTBFeExURXVZM0pzTUVpZ1JxQkVoa0pvZEhSd09pOHZZM0pzTkM1a2FXZHBZMlZ5DQpkQzVqYjIwdlJHbG5hVU5sY25SSGJHOWlZV3hITWxSTVUxSlRRVk5JUVRJMU5qSXdNakJEUVRFdE1TNWpjbXd3DQpnWWNHQ0NzR0FRVUZCd0VCQkhzd2VUQWtCZ2dyQmdFRkJRY3dBWVlZYUhSMGNEb3ZMMjlqYzNBdVpHbG5hV05sDQpjblF1WTI5dE1GRUdDQ3NHQVFVRkJ6QUNoa1ZvZEhSd09pOHZZMkZqWlhKMGN5NWthV2RwWTJWeWRDNWpiMjB2DQpSR2xuYVVObGNuUkhiRzlpWVd4SE1sUk1VMUpUUVZOSVFUSTFOakl3TWpCRFFURXRNUzVqY25Rd0RBWURWUjBUDQpBUUgvQkFJd0FEQ0NBWUVHQ2lzR0FRUUIxbmtDQkFJRWdnRnhCSUlCYlFGckFIY0EyQWxWTzVSUGV2L0lGaGx2DQpsRStGcTdENC9GNkhWU1lQRmRFdWNydEZTeFFBQUFHWThYRGVoQUFBQkFNQVNEQkdBaUVBckk3M09OcGF5dUd4DQpwOWFZaXdxdWYyanVSbDQvMHl3eU52YWFIRXNHN1RzQ0lRQ3pPSVgxeTRxc2tValNtaU4yVEFUbmNSOEJpc2NIDQpxV3RnU1NDMG92Vk95Z0IzQU1JeGZsZEZHYU5GN244NDNyS1FRZXZId2lGYUlyOS8xYld0ZHByWkRsTE5BQUFCDQptUEZ3M29rQUFBUURBRWd3UmdJaEFPbzRNemhYMnYxWUl0bjlaQWZwMW5QbmVId2s0QUljcWpZbVZOWlpnSHRKDQpBaUVBclZweXFMeVpWdit4ZytUUmx0VmVDTXh5WElzL2lPWHJ1cFFUK3I5Sy9kTUFkd0NVVGtPSCt1ekI3NEh6DQpHU1FtcUJobEFjZlRYemdDQVQ5eVozMVZOeTRaMkFBQUFaanhjTjZZQUFBRUF3QklNRVlDSVFDUXBTN2hDeVVFDQpjUXJhZFpqTm1NQllrcnBVVVVudUdpOG9yeGZKSnlpSHdBSWhBSWZCSWNueForYWlFYUpLc3ZzUU5PRTRDc2RBDQpOSlpUMU1DZEhlNHl0VG5WTUEwR0NTcUdTSWIzRFFFQkN3VUFBNElCQVFDTUNjOXMvcDFocnptYVFhUk9iK05aDQo3Vit6Qy9nYnpLamxDZ2hBOHdodS9qTWFQRjJEVFJCRkFERTBYcW84TUVZTU1GZmVLMUovaWR5SkYzUWN0c25yDQpDcVlSNDZ2MlJXZ3FsR0tCOHJ4cFJvdDlSSmlZN0RUVjZTTUFVSWg1N3JET28wd2xQZ1JNV0RaYVVvR3hJVTlsDQpaYU5IOGZDdGZDSFg4UVREQUJXWkdLbjdvQUYwdmRFQ1BFUkI0ckxSWmovbnRFUTJaVnVXSTdkMEc3QzA3bmVCDQplZ04yenh0TXFSYjIvMHhxL0pHVlE4bDdwRjdYLzJMcGpDd3pzQ0JCaFg4OTh2cXJZNnJtbFprclV6WXpmejR4DQpabnltTm4xYUZsVTQ1aVAvR3VuSVQ4NnBxelMvc1htdWg3RWFYcENUekFoVHMxOFByRC80NkZKaVA3TklCUzJNDQotLS0tLUVORCBDRVJUSUZJQ0FURS0tLS0t",
  "pulse": {
    "certificateId": "528943a555f5f8ca54423be6dfb95925a35c7b552046420e7d7cd072058a14d6536ad3a8e9754b6582f164a90b0cd86a65d659f5426a2659a947595d1c816c8c",
    "chainIndex": 2,
    "cipherSuite": 0,
    "external": {
      "sourceId": "00000000000000000000000000000000000000000000000000000000000000000000000000000000000000000000000000000000000000000000000000000000",
      "statusCode": 0,
      "value": "00000000000000000000000000000000000000000000000000000000000000000000000000000000000000000000000000000000000000000000000000000000"
    },
    "listValues": [
      {
        "type": "previous",
        "uri": "https://beacon.nist.gov/beacon/2.0/chain/2/pulse/1886799",
        "value": "8CB8D587AD296029219D5D110F6F2F077B5C4956D9083A7B9A557AD459165C47C310B54855E816A206F869CE88F90AC6FACBD0E20939DF1447CC43F3F260B859"
      },
      {
        "type": "hour",
        "uri": "https://beacon.nist.gov/beacon/2.0/chain/2/pulse/1886740",
        "value": "EF75B2B2E4E9207F8A02F564BC3A2C46A35D90DF3ACBA929701F7CEAC9D1842ED470522B5BACA2744BBE6EDD8368486164972EC59E340495055CD063C444A969"
      },
      {
        "type": "day",
        "uri": "https://beacon.nist.gov/beacon/2.0/chain/2/pulse/1885720",
        "value": "E76F55FD634192BC20563E544C78E9874331822AD85EE61FEC704DC5E35F2DFD05B0ECC85CD1F7A7959EEFC306D56D8AF6EC17267962C5D305ADBB5116074AB8"
      },
      {
        "type": "month",
        "uri": "https://beacon.nist.gov/beacon/2.0/chain/2/pulse/1884280",
        "value": "E9B85FC90413B5508783DC458B70149310F6E65A5181960750F5F7CD1ABA711C13628B306023949945256F3BBC298176B0B56A77820A71662D1934EE983325B0"
      },
      {
        "type": "year",
        "uri": "https://beacon.nist.gov/beacon/2.0/chain/2/pulse/1595005",
        "value": "A5FD82C3D2D3BD40D828416E16786CB12040BE747E0558CB834430D356760749B4DE671A660D6A4F16BBEBF1219A4376C14030F3D6A15CF26884B3244675159C"
      }
    ],
    "localRandomValue": "6C088D9513FB1E703F52DA39F91CA9C356F3780EEAB45DFD2B4D54BAF53B92E6917E2269BA374F7F213C129D114E821F9C211CB34A607DA8FA67289F58D583E9",
    "outputValue": "9A35D9DE58230AC3171FCA34BC1B01FE0E8A90F6C17998F946226867862CF5DDD08B42E4D01CDED7340A392E6488880FB4574B288D4ED243E5A1F0ABCED9828B",
    "period": 60000,
    "precommitmentValue": "634DE4AD1C93FF75B9FB0C2AEC59B3B6586B274E3DED835EC3A8103D93E97FAAD3D781B526D7B30D8C3BA78C6CFEE18C142166D0CF6881714803E4AC3BFF9A52",
    "pulseIndex": 1886800,
    "signatureValue": "535BF19DD0374309839AEF26EC38C61F8D63C735606C0977D3479BE0042531F5F8CEAA2E362FA71698C234604FEB7DC42D5D1F10E1B9359233106C7B162A7CA831C4D915FD336CB165FB7E28B4EB2A2332C5B8E8CCC938BAD8AFC5C2597D08200D3564BFCF39F7FFA8674621CA05290A2A4E459540246D8A39F8CF81CC810809AD447DA758B785A95A58D816F38011D6161FCC3DCD36760C0E3CA56E7047B8BFDCA75F37680B4B9FB750000A1A246033F224DEC0AB86CA09D782121DCD3A6E7854B6E2E90AB5135BCCC58B1A34670DABAA98A0C5CFF80E4B9683DAFD5C39C015995295F5DA08010C944159AF3F1B522DD4AAED92B95341B672EE29882AF7B1FD4C40F1AF0FE48C9EE65C92D06FA00AB2D753997BE04A9CD516E0B06B3DD2A7ACC21EDA3013908B2F1F4EB55684FBAB2C1F88FFC8295E134442E08E510A091EF9A439FC1BBB00A083FCF0E7477397D3CA5B357276236BB9C6FA80FED5D50F708A8DE92F39E5A99603B9A7361F94DD6B8F539C02A0BCAC6684797D53EDF49CD67552283ED5445E97599D2B52CAFCCBCA3C5CAF2C0803F15B162A8F99A6B38114E7479B6BD5DF34F3961CDCAB239E4F583048FD81AE9953D972E6808AC787519F4328CE2A91C0F41936713B5DCB31400D42653CA6EC8BD59940254DCC6B8FF46DC0AB51EC1631E2CCC3752CC351089CBC551E0EF88344F4A363D13F4DBF2D639CD6",
    "statusCode": 0,
    "timeStamp": "2026-08-02T18:00:00.000Z",
    "uri": "https://beacon.nist.gov/beacon/2.0/chain/2/pulse/1886800",
    "version": "2.0"
  },
  "pulseEndpoint": "https://beacon.nist.gov/beacon/2.0/pulse/time/1785693600000",
  "registrationArtifactSHA256": "7c0cb4cf544773041be84e75de4314c72769c71682e1b138b99ea85996cc5779",
  "resolutionSHA256": "954450cef05abb3d07b0346eda096c7a5aa69b610ce7491874be7f7c063c3a95",
  "resolvedAt": "2026-08-02T18:15:46Z",
  "schemaVersion": "corelm-beacon-resolution-v1",
  "selection": {
    "candidateCount": 15,
    "candidateIndex": 13,
    "counter": 0,
    "rejectionLimitHex": "ffffffffffffffffffffffffffffffffffffffffffffffffffffffffffffffffffffffffffffffffffffffffffffffffffffffffffffffffffffffffffffffff",
    "seedDigestSHA512": "435ba738ff76ca89582a763ac2b1295e4db03c49c368d5876e4d2d0d7daecc5d82f50c4bef4046d96b76b0c6c6fd187122e3f964457503ed93317cd6ff3512a9",
    "selectedWindow": {
      "blocks": 32,
      "id": "test-512-543",
      "split": "test",
      "startBlock": 512
    }
  },
  "status": "beacon-resolved-before-model-data",
  "suiteId": "qwen2.5-0.5b-kv-voidtoken-v5-beacon-heldout-v1",
  "verification": {
    "certificateDER_SHA512": "528943a555f5f8ca54423be6dfb95925a35c7b552046420e7d7cd072058a14d6536ad3a8e9754b6582f164a90b0cd86a65d659f5426a2659a947595d1c816c8c",
    "certificatePEM_SHA256": "acd33ba715a14c1d2c1601983c38cb7e671de151c3536fdf25097f28f9533229",
    "chainIndex": 2,
    "outputValue": "9A35D9DE58230AC3171FCA34BC1B01FE0E8A90F6C17998F946226867862CF5DDD08B42E4D01CDED7340A392E6488880FB4574B288D4ED243E5A1F0ABCED9828B",
    "outputValueVerified": true,
    "pulseIndex": 1886800,
    "signatureVerified": true
  },
  "windowLedgerSHA256": "81e84d09682bb4beab5f42c8bd87179a874b879eaf6e6ca539723e54bbc75a83"
}
